{
  "manifest_version": "1.0.0",
  "pack_id": "uht-core",
  "version": "v1.2.0",
  "status": "approved",
  "ontology_hash": "sha256:00112233445566778899aabbccddeeff00112233445566778899aabbccddeeff",
  "owlbin_hash": "sha256:ffeeddccbbaa99887766554433221100ffeeddccbbaa99887766554433221100",
  "profile_policy": {
    "online_profiles": [
      "EL",
      "RL"
    ],
    "dl_fallback": "offline_only",
    "notes": "Online transaction path is limited to EL/RL-safe constructs."
  },
  "artifacts": {
    "source_files": [
      {
        "path": "ontologies/uht/prov-o.owl",
        "sha256": "sha256:1111111111111111111111111111111111111111111111111111111111111111",
        "format": "owl"
      },
      {
        "path": "ontologies/uht/epcis-core.ttl",
        "sha256": "sha256:2222222222222222222222222222222222222222222222222222222222222222",
        "format": "ttl"
      }
    ],
    "owlbin_uri": "s3://uht-consortium/ontology-packs/uht-core/v1.2.0/uht-core-v1.2.0.owlbin",
    "owlbin_sha256": "sha256:ffeeddccbbaa99887766554433221100ffeeddccbbaa99887766554433221100",
    "schema_assets": [
      {
        "type": "json_schema",
        "uri": "s3://uht-consortium/schemas/epcis-2.0.0/event.schema.json",
        "sha256": "sha256:3333333333333333333333333333333333333333333333333333333333333333"
      },
      {
        "type": "shacl",
        "uri": "s3://uht-consortium/shacl/epcis-constraints-v1.2.0.ttl",
        "sha256": "sha256:4444444444444444444444444444444444444444444444444444444444444444"
      }
    ]
  },
  "governance": {
    "created_at": "2026-02-15T03:00:00Z",
    "approved_at": "2026-02-16T09:00:00Z",
    "approved_by": [
      "governance-chair-01",
      "uht-committee-07"
    ],
    "approval_txid": "govtx-01JH3Y2F5B8NQ9P2V0",
    "signature": "base64:MEYCIQDd2P7H8JQm9r4R6W2k3f7Q8kY3qJ8x4Gm5nL6p7r8s9AIhAL9Xk5p3f2d1s0a9b8c7d6e5f4g3h2i1j0k9l8m7n6o5"
  },
  "compatibility": {
    "tableauxx_min_version": "0.2.0",
    "parser_runtime_version": "rdfxml-stream-v3",
    "migration_from": [
      "v1.1.0"
    ]
  },
  "conformance_report": {
    "uri": "s3://uht-consortium/reports/uht-core/v1.2.0/conformance-report.json",
    "sha256": "sha256:5555555555555555555555555555555555555555555555555555555555555555",
    "checker": "owlapi-profile-checker-1.0.0"
  }
}
